{
  "contract_version": "generation-manifest/1",
  "pack": "fixture-minimal",
  "pack_version": "0.1.0",
  "framework_version": "0.1.0",
  "artifacts": [
    {
      "ko": "ko.definition.sales.customer",
      "class": "type",
      "path": "src/sales/types/customer.ts",
      "content_hash": "sha256:0000000000000000000000000000000000000000000000000000000000000000",
      "pack_version": "0.1.0"
    },
    {
      "ko": "ko.definition.sales.proposal",
      "class": "type",
      "path": "src/sales/types/proposal.ts",
      "content_hash": "sha256:0000000000000000000000000000000000000000000000000000000000000000",
      "pack_version": "0.1.0"
    },
    {
      "ko": "ko.definition.sales.proposal-already-issued",
      "class": "type",
      "path": "src/sales/types/proposal-already-issued.ts",
      "content_hash": "sha256:0000000000000000000000000000000000000000000000000000000000000000",
      "pack_version": "0.1.0"
    },
    {
      "ko": "ko.definition.sales.proposal-expired",
      "class": "type",
      "path": "src/sales/types/proposal-expired.ts",
      "content_hash": "sha256:0000000000000000000000000000000000000000000000000000000000000000",
      "pack_version": "0.1.0"
    },
    {
      "ko": "ko.definition.sales.proposal-item",
      "class": "type",
      "path": "src/sales/types/proposal-item.ts",
      "content_hash": "sha256:0000000000000000000000000000000000000000000000000000000000000000",
      "pack_version": "0.1.0"
    },
    {
      "ko": "ko.definition.sales.proposal-not-issued",
      "class": "type",
      "path": "src/sales/types/proposal-not-issued.ts",
      "content_hash": "sha256:0000000000000000000000000000000000000000000000000000000000000000",
      "pack_version": "0.1.0"
    },
    {
      "ko": "ko.definition.sales.proposal-terminal",
      "class": "type",
      "path": "src/sales/types/proposal-terminal.ts",
      "content_hash": "sha256:0000000000000000000000000000000000000000000000000000000000000000",
      "pack_version": "0.1.0"
    },
    {
      "ko": "ko.lifecycle.sales.proposal",
      "class": "conformance-test",
      "path": "src/sales/conformance/proposal.test.ts",
      "content_hash": "sha256:0000000000000000000000000000000000000000000000000000000000000000",
      "pack_version": "0.1.0"
    },
    {
      "ko": "ko.lifecycle.sales.proposal",
      "class": "state-machine",
      "path": "src/sales/state/proposal.ts",
      "content_hash": "sha256:0000000000000000000000000000000000000000000000000000000000000000",
      "pack_version": "0.1.0"
    },
    {
      "ko": "ko.rule.sales.proposal-expiration",
      "class": "conformance-test",
      "path": "src/sales/conformance/proposal-expiration.test.ts",
      "content_hash": "sha256:0000000000000000000000000000000000000000000000000000000000000000",
      "pack_version": "0.1.0"
    },
    {
      "ko": "ko.rule.sales.proposal-expiration",
      "class": "validator",
      "path": "src/sales/validators/proposal-expiration.ts",
      "content_hash": "sha256:0000000000000000000000000000000000000000000000000000000000000000",
      "pack_version": "0.1.0"
    },
    {
      "ko": "ko.rule.sales.proposal-validity",
      "class": "conformance-test",
      "path": "src/sales/conformance/proposal-validity.test.ts",
      "content_hash": "sha256:0000000000000000000000000000000000000000000000000000000000000000",
      "pack_version": "0.1.0"
    },
    {
      "ko": "ko.rule.sales.proposal-validity",
      "class": "validator",
      "path": "src/sales/validators/proposal-validity.ts",
      "content_hash": "sha256:0000000000000000000000000000000000000000000000000000000000000000",
      "pack_version": "0.1.0"
    }
  ]
}
